index,text,label
0,"Zimbabwe annual inflation drops to 209 percent: report (AFP) AFP - Zimbabwe's annual rate of inflation last month dropped to 209 percent, edging closer to a year-end target of 150 percent from a peak of 622.8 percent in January, according to a newspaper report.",0
1,"More than 1,000 dead in Haiti (09/23/04)-- A mass grave in Haiti now holds more than 100 bodies -- and there may have to be many more such graves before the recovery from Tropical Storm Jeanne is complete.",0
2,Seven die in Japan  #39;suicide pact #39; Japanese police have found the bodies of seven young people - three women and four men - in a van in the Saitama mountains to the west of Tokyo.,0
3,"Security No. 1 for Afghan head President Hamid Karzai promised Thursday to assemble a representative government, but said he did not feel bound to offer top Cabinet positions to his defeated rivals.",0
4,"Palestinians say they hope Bush accepts dealing with Arafat in new &lt;b&gt;...&lt;/b&gt; An ailing Yasser Arafat congratulated President Bush on his re-election and expressed hope that a second term will spark new life to the Middle East peace process, an aide to the Palestinian leader said Wednesday.",0
5,France Seeks Return of Reporters in Iraq Amid Headscarf Threat The French government demanded the release of two journalists kidnapped in Iraq by a group demanding that France rescind a ban on Islamic headscarves in the nation #39;s schools within 48 hours.,0
6,"Ads Make Closing Arguments in Campaign (AP) AP - President Bush promises to do ""whatever it takes"" to keep the country safe. Democrat John Kerry says Bush has failed and calls for ""a fresh start.""",0
7,Mourning for submariner spans an ocean HALIFAX - Navy Lieut. Chris Saunders was honoured as a joyful father and a fearless sailor yesterday by mourners on both sides of the ocean following last week #39;s tragic fire on HMCS Chicoutimi.,0
8,"Palestinian Girl Killed in Gaza Strip, Medics Say (Reuters) Reuters - Israeli troops shot dead a 7-year-old\Palestinian girl in a Gaza refugee camp on Friday, medics said,\after militants wounded four Israelis in a mortar attack on a\nearby Jewish settlement.",0
9,"US Marine killed in Iraq #39;s western Anbar province One US Marine was killed in action Saturday in Iraq #39;s volatile western Anbar province, the military said. The Marine, who was assigned to the 1st Marine Expeditionary Force, was killed  #39; #39;while ",0
10,Musharraf to meet Singh at the UN The leaders of India and Pakistan head to the US this week for talks with each other and with President Bush.,0
11,"Cambodia Women's Shelter Closes After Raid (AP) AP - A shelter for women and girls forced into the sex trade temporarily shut its doors Friday after gunmen kidnapped 92 of its occupants and made death threats against the staff, the shelter's director said.",0
12,"Martin says Canada ready to help train election workers, monitor vote in Iraq (Canadian Press) Canadian Press - OTTAWA (CP) - The Canadian government is willing to smooth the way toward a national election in Iraq by helping to train officials there and monitor the voting process, say Prime Minister Paul Martin.",0
13,"Is US Rhetoric Fuelling Iran #39;s Nuclear Program? As Iran announces it is resuming its nuclear program, we speak with Iranian-born author and former diplomat Mansour Farhang about the increasing tensions in the United States towards Tehran.",0
14,"Hong Kong Swears in New Legislature (AP) AP - New Hong Kong lawmakers were sworn in Wednesday, and one of their newest members  #151; a longtime activist  #151; shattered the solemnity by shouting pro-democracy slogans as he joined the system he has spent years protesting.",0
15,Death Toll from Israel #39;s Gaza Offensive Rises to 100 Israeli air strikes killed five Palestinians in Gaza Thursday as the Palestinian death toll rose to 100 in a 16-day-old army offensive aimed at crushing militants behind rocket salvoes into Israel.,0
16,Focus on Aust as Russia adopts Kyoto protocol The major parties #39; different approaches to the Kyoto Protocol on greenhouse gas emissions became starker today after Russia made steps to ratify the agreement.,0
17,Djamshid says farewell and thank you to Canada on eve of long trip home (Canadian Press) Canadian Press - TORONTO (CP) - A 10-year-old Afghan boy whose struggle for life captured the hearts of Canadians bade a fond farewell to the country that rescued him Thursday as he prepared for a long journey home to a life of abject poverty.,0
18,Quelling the fire Close your eyes. Imagine that Byrd Stadium is filled with people. Only these are not regular Terps fans. These are mainly men and boys uprooted from their villages - and they #39;re dead.,0
19,Brazilian Soldier Wounded in Haiti Unrest A Brazilian soldier with the UN peacekeeping force in Haiti was shot and wounded Saturday when peacekeepers and local police faced gunfire in a crackdown on armed gangs in the Haitian capital.,0
20,Chile #39;s Pinochet facing human rights charges A judge in Chile is once again trying to bring former dictator Augusto Pinochet to trial for humans rights abuses during his 1973-90 regime.,0
21,"Bush to Highlight Tort Reform in Ill. (AP) AP - A little county with a reputation for big lawsuits  #151; some call it a ""judicial hellhole""  #151; is getting a visit from a man who wants to make it much tougher to sue somebody.",0
22,"Rebuffed by Party, Sharon Presses on with Gaza Plan  JERUSALEM (Reuters) - Israeli Prime Minister Ariel Sharon  vowed on Thursday to press ahead with his Gaza pullout plan  despite his own party's humiliating rebuff of his bid to forge  a coalition with the pro-withdrawal Labour Party.",0
23,Judge wants speed on Abu Ghraib evidence A military judge today warned the US government that the slowness of its investigations into alleged abuse at an Iraqi prison could derail the cases against the accused soldiers.,0
24,"Thai Prime Minister admits army made mistakes PATTANI - Thailand #39;s Government faced withering criticism after nearly 80 Muslims suffocated to death while in Army custody, with one newspaper blaming the tragedy on the Prime Minister #39;s  quot;flawed quot; leadership.",0
25,"Hurricane Frances Causes Damage in Bahamas Howling winds and severe flooding brought by Hurricane Frances pounded the Bahamas for two days, leaving at least two people dead, homes destroyed and yards littered with mangled trees.",0
26,"Italian premier tells EU immigration control top priority Italian Prime Minister Silvio Berlusconi said Thursday that the problem of immigration was one of three priority issues facing his government, the day after it resumed mass deportations of illegal immigrants.",0
27,"Bush defends action against Iraq President Bush backs his policy on Iraq, despite confirmation that Saddam Hussein did not have WMD.",0
28,"Blast in Gaza House Kills at Least Two (AP) AP - An explosion in a house in Gaza City early Wednesday killed at least two people, Palestinian witnesses said. It was not immediately known what caused the blast.",0
29,"PM says his Chinese visit to strengthen close ties ISLAMABAD, Dec 14 (NNI): Prime Minister Mr. Shaukat Aziz Tuesday said his visit will China will go a long way to strengthen existing close ties between the two countries in all fields.",0
30,"Blair outlines Sudan demands Tony Blair today said the Sudanese government had agreed to a five-point action plan aimed at ending the conflict in Darfur, which has resulted in what the UN describes as the world #39;s worst humanitarian crisis.",0
31,Iranian MP welcomes Allawi visit to Tehran Iranian Majlis deputy and member of foreign policy and national security commission Elham Aminzadeh said Monday the forthcoming trip of Iraqi Prime Minister Iyad Allawi to Iran ushers in a new chapter in bilateral relations.,0
32,Rwanda snubs UN forces in DR Congo Rwanda tells the UN Security Council its plans to disarm rebels across the border in DR Congo will not work.,0
33,Arbitration Court Rules That Hamm Is Gold Medal Winner in Gymnastics The courts decision marked the official end of a controversy that had simmered since Paul Hamm captured the gold after a close finish.,0
34,"Hostage Takers Widen Demands Beyond Iraqi Affairs BAGHDAD, Aug 29 (AFP) - For the first time since the kidnappings of foreigners started in Iraq in April, hostage takers have set conditions external to the country by demanding that France lift a ban on Islamic headscarves in state schools.",0
35,"US: Sudan attacks racially based While not directly calling the crisis in Darfur a genocide, the US State Department has said that interviews with Sudanese refugees indicated attacks against the regions #39; black Africans appeared to be racially motivated.",0
36,Bush lifts Libya trade sanctions The US lifts a trade embargo to reward Libya for its decision to give up weapons of mass destruction.,0
37,"Republicans, Democrats Swap Louisiana House Seats (Reuters) Reuters - The 2004 U.S. elections ended on\Saturday with Republicans and Democrats swapping one U.S. House\of Representatives seat each in runoff elections in Louisiana.",0
38,Elton sells off photo collection Sir Elton John is to sell off part of his extensive photographic collection at an auction in New York.,0
39,"CLIFFORD D. MAY: Shouldn #39;t Palestinians have a real election? (SH) - In Afghanistan, Hamid Karzai defeated a raft of candidates to win his historic election. In Iraq, more than 200 political parties have registered for next month #39;s elections.",0
40,Barrichello takes Monza win Rubens Barrichello leads home Michael Schumacher to seal a Ferrari one-two at the Italian Grand Prix.,0
41,More Aftershocks as Japan Aids Quake Victims Japan resumed rescue efforts at first light on Monday as aftershocks rattled the area where the country #39;s deadliest earthquake in nine years killed at least 23 ,0
42,"Walk the reforms road, UN tells Myanmar YANGON, Oct. 20. - A change in Myanmars political leadership brought fresh calls today for the military-ruled south-east Asian country to carry on with promises to restore democracy.",0
43,"Israeli forces kill two Palestinians in Gaza gunfight JERUSALEM - Israeli forces shot dead two Palestinian gunmen Wednesday during a firefight in the northern Gaza Strip, Israeli military sources said.",0
44,Four held as raid uncovers  #39;plot to buy dirty bomb #39; Four men have been arrested on suspicion of terrorist offences as part of a planned operation by the Metropolitan Police. The men are suspected of attempting to buy radioactive material for ,0
45,"Putin: Iraq Still Too Dangerous for Russian Firms Iraq is still too dangerous for Russian companies to work there, President Vladimir Putin was quoted as saying on Friday.  quot;Our companies are ready to return to Iraq as soon as the necessary ",0
46,Senior officers threaten to quit Israeli army in settlements rift Senior military officers have threatened to leave the Israeli army in protest at Ariel Sharon #39;s proposals for disengagement from Gaza.,0
47,Ex-OAS Chief Ordered Held in Costa Rica (AP) AP - A Costa Rican appeals court judge ordered the former head of the Organization of American States jailed Friday while prosecutors prepare corruption charges against him for allegedly accepting kickbacks when he was the nation's president.,0
48,Armed Group Claims to Have Iraq Explosives (AP) AP - An armed group claimed in a video Thursday to have obtained a large amount of explosives missing from a munitions depot facility in Iraq and threatened to use them against foreign troops.,0
49,After the  #39;Road Map #39; What Ariel Sharon has been indicating for months is now stated Israeli policy: The US-drawn  quot;road map quot; to a Palestinian state is locked in the glove compartment - along with other failed peace plans.,0
50,"A Mild Shanghai Lawyer and His Accidental Crusade The personal history of Guo Guoting is of the hard-knock variety commonplace in China, where one old rule endures: you can't fight City Hall.",0
51,"Final Touches Set on Africa Great Lakes Peace Plan (Reuters) Reuters - African leaders put final touches\on a new, U.N.-backed peace plan for the troubled Great Lakes\countries on Saturday amid fresh allegations of gun-running,\abuse and violence in the vast, volatile region.",0
52,"U.S. Rules Out Iraq Women Prisoner Release BAGHDAD, Iraq - Authorities insisted they won't give in to militants' demands to free female Iraqi prisoners despite the plea of a tearful British hostage begging Britain to save his life in a video released by his captors.    The captive, Kenneth Bigley, appealed to British Prime Minister Tony Blair to intervene...",0
53,Thousands flock for glimpse of new Cambodian king as coronation &lt;b&gt;...&lt;/b&gt; PHNOM PENH : Thousands of Cambodians flocked to the royal palace to catch a glimpse of new King Norodom Sihamoni as his formal coronation period ended with the extinguishing of a candle.,0
54,Israel Urged to Limit Military Response (AP) AP - The State Department called on Israel Friday to limit its military response to a rocket attack by Hamas that killed two small Israeli children.,0
55,"Spacewalking Astronauts Replace Equipment CAPE CANAVERAL, Fla. - Leaving their orbiting outpost unmanned, the international space station's two astronauts floated outside on a spacewalk Friday and plugged in new antennas and replaced a worn-out piece of cooling equipment...",0
56,"India to build oil pipeline to Nepal India is to build a pipeline into Nepal to ensure smooth supply of petroleum products in the Himalayan nation torn by an increasingly violent Maoist insurgency, an oil official said on Thursday.",0
57,"AP Reporter Recalls Deng for His Humor (AP) AP - Many Americans remember the late Deng Xiaoping as a little man with big ideas at a Houston, Texas, barbecue grinning up at the cameras from under a ten-gallon hat.",0
58,Cranes rain down as peace gesture Millions of origami paper cranes yesterday rained down upon Thailand #39;s three violence-torn southern provinces in an extravagant government-sponsored gesture aimed at bringing peace to the predominantly Muslim region.,0
59,"Group claims execution of Italian hostages in Iraq: website (AFP) AFP - A group calling itself the  quot;Jihad Organization quot; said it had  quot;slaughtered quot; two Italian female hostages in Iraq, in a statement posted on an Islamist website.",0
60,Putin casts doubt on Iraq polls Russian President Vladimir Putin cast doubt on Tuesday over the viability of holding elections as planned next month in an Iraq under  quot;total occupation quot;.,0
61,"Venezuela plane crash kills 25 A Venezuelan air force plane carrying three crew members and 22 passengers has crashed in bad weather in central Venezuela, killing all on board, an aviation official said Sunday.",0
62,Sri Lankan opposition MP jailed A leading Sri Lankan opposition politician is given a prison sentence for defaming the supreme court.,0
63,CORRECTED: Microsoft's Ballmer Warns Asia of Linux Lawsuits (Reuters) Reuters - Microsoft Corp. Chief Executive\Officer Steve Ballmer on Thursday warned Asian governments that\they could face intellectual rights-infringement lawsuits for\using rival open-source operating platforms such as Linux.,0
64,"Tom Plate The Latest China Syndrome You can bet they have been salivating, waiting patiently for the delicious, divisive moment: for Cultural Revolution Two or Tiananmen Square Two.",0
65,"No Apology from UK Prince After Nightclub Scuffle Britain #39;s Prince Harry, struggling to shed a growing  quot;wild child quot; image, won #39;t apologize to a photographer he scuffled with outside an exclusive London nightclub, a royal spokesman said on Saturday.",0
66,"Colombian Tells of Marxist Plot Against Bush Marxist rebels had planned to assassinate President Bush last Monday during his four-hour stopover in Colombia to meet President lvaro Uribe, Defense Minister ",0
67,"Pak won #39;t give up Kashmir: Musharraf Islamabad: As Islamabad and New Delhi resume back channel diplomacy with the visit of a senior Pakistani official to India for talks with National Security Advisor JN Dixit, Pakistan President Pervez Musharraf declared his country would not give up Kashmir ",0
68,Kidnappers threaten to hand Hassan to al-Zarqawi The kidnappers of British hostage Margaret Hassan have threatened to hand her over to an al-Qaida-related group led by Abu Musab al-Zarqawi unless their demands - including the ,0
69,"Patriots Beat Colts 27-24 in NFL Opener FOXBORO, Mass. - As usual, Tom Brady was uncannily accurate as the New England Patriots moved within three games of the NFL record for consecutive victories...",0
70,"Israel arrests nuclear whistleblower for  #39;leak #39; JERUSALEM: Israeli police have put nuclear whistleblower Mordechai Vanunu under house arrest on suspicion of spilling more state secrets, seven months after he completed an 18-year prison term for treason.",0
71,Red Crescent aid convoy enters Fallujah A Red Crescent convoy of emergency supplies entered Fallujah on Saturday amid fears of a growing humanitarian crisis in the Iraqi battle zone as a massive US led offensive against rebels entered its sixth day.,0
72,"Plans to Expand Settlements Spark Anger (AP) AP - The recent announcement of plans to add more than 1,800 housing units to West Bank settlements may have sparked world anger, but on the ground it's just business as usual. The fact is  #151; settlement building never stopped.",0
73,"Russia, China Hold Trade, Anti-Terrorism Talks Russian President Vladimir Putin and China #39;s prime minister, Wen Jiabao, have met in Moscow for talks on trade and the fight against terrorism.",0
74,Prince Charles to reopen British Consulate The Prince of Wales is expected to reopen today the British Consulate General which was restored after last year #39;s suicide bomb attack in the heart of Istanbul which long with three other similar attacks killed dozens of people.,0
75,"Ivory Coast rebels agree to speed peace process Ivory Coast rebels renewed a pledge to speed up a peace initiative on Friday, a day after the UN Security Council threatened sanctions if the civil war #39;s belligerents ",0
76,"Women Voters Declines San Diego Appeal (AP) AP - The League of Women Voters of San Diego said Tuesday that it will not appeal a judge's ruling in the city's mayoral election, dealing another setback to Councilwoman Donna Frye's write-in bid.",0
77,"Sharon Tells Party Rebels He #39;s Not Afraid of Early Elections Israeli Prime Minister Ariel Sharon sent a stern warning to rebels in his Likud Party today, saying he would not hesitate to call early elections if they prevented him from bringing the moderate Labour Party into the government.",0
78,Australia is unlikely to sign nonaggression pact with Asean Prime Minister John Howard said Friday he is unlikely to sign a nonaggression pact with Australia #39;s Asian neighbors. The issue is reportedly causing tension ahead of Howard #39;s visit ,0
79,Shiite Militia Fighters Start Turning in Weapons in Baghdad Followers of radical cleric Moqtada Sadr trickled in to police stations in Baghdad #39;s Sadr City district to hand in weapons today under a deal seen as a key step toward ending weeks of fighting with US and Iraqi forces in the Shiite militant stronghold.,0
80,"Sharon urges OK of Gaza pullout JERUSALEM - Saying Israel faced a  quot;fateful hour, quot; Prime Minister Ariel Sharon urged parliament on Monday to approve his controversial plan to withdraw Jewish settlers from the Gaza Strip and a small portion of the West Bank.",0
81,SF accused of giving DUP veto over nationalist ministers The SDLP has accused Sinn Fin of giving the Democratic Unionist Party a veto over the decisions of nationalist ministers as part of the deal to restore power-sharing.,0
82,"Safe injection site visited by 600 users daily ""exceeding expectations:"" report (Canadian Press) Canadian Press - VANCOUVER (CP) - Operators of North America's first safe injection site for intravenous drug users are claiming success, saying the site has ""saved lives and improved lives.""",0
83,Bush Hopes Terror Message Resonates in N.J. (AP) AP - George W. Bush is telling voters in New Jersey  #151; a state that hasn't backed a Republican presidential candidate since 1988  #151; that his battle plan for fighting terrorists is better than Democrat John Kerry's.,0
84,"Unionists must make power-sharing pledge - Adams Unionist demands for the IRA to be wound up can be met as soon as they give a pledge to share power in Northern Ireland, Gerry Adams stressed today.",0
85,David celebrates 500th birthday \The 500th aniversary of the unveiling of Michelangelo's David is celebrated in Florence.,0
86,Congress Finishing Up  #36;338B Spending Bill (AP) AP - White House and congressional bargainers sorted through a final pile of disputes Friday on an overdue  #36;388 billion spending bill that would slice President Bush's priorities and curb a wide swath of programs.,0
87,"North Korea may test-fire missile: spy satellite data Japanese and US reconnaissance information indicates that North Korea might be preparing to test-fire either a Nodong or Taepodong ballistic missile, Japanese government sources said Thursday.",0
88,Row over Australian army photo A Sydney newspaper has published a photograph of Australian soldiers posing as members of the Ku Klux Klan. The Daily Telegraph said the soldiers were dressed like that to intimidate young Aboriginal recruits.,0
89,Pakistan assembly discards anti-speaker motion (Reuters) Reuters - Pakistan's National Assembly discarded a no-confidence motion against its speaker on Friday after opposition deputies declined to vote when the deputy speaker refused to allow all 107 of those present to speak.,0
90,"Terrorism ; Britain takes special steps to battle terrorism Terrorism News, London,Britain is drawing up far-reaching proposals to tackle terrorism, including allowing the use of phone-taps as evidence in trials and special anti-terror courts.",0
91,"US Planes Hit Iraq's Falluja, Zarqawi Man Seized  FALLUJA, Iraq (Reuters) - U.S. warplanes bombed targets in  Iraq's rebel-held city of Falluja overnight, killing two people  and wounding three, and the U.S. military said it had captured  a wanted militant on Saturday.",0
92,"U.S. Army Base Faces Uncertain Fate At Ulrich Jung's hair salon, rumors are flying about the future of this small town in the rolling hills of southwestern Germany. One customer with a buzz cut has heard that all the U.S. troops will leave by 2007. Someone else has information that they will be gone sooner, perhaps within a year.",0
93,"EU fast-tracks action to end institutional limbo Incoming European Commission head Jose Manuel Barroso acted Friday to end an unprecedented EU stalemate, by arranging fast-track confirmation hearings for his re-arranged Brussels executive team.",0
94,"ISRAELIS ARREST 2 BOMB GALS JERUSALEM - Two Palestinian women planning to carry out homicide bombings were arrested in the last two days, and Israeli forces are conducting a massive search for a third, officials said yesterday.",0
95,"M.T.A. Spent \$15 Million on Officers' Overtime A third of the M.T.A.'s police officers were paid more than \$100,000 last year, and some officers doubled and even tripled their base salaries by working overtime.",0
96,"Ivorian president fires army chief Ivory Coast President Laurent Gbagbo has fired his army chief of staff, Gen Mathias Doue, the BBC reported Saturday. Gbagbo hired Col Philipe Mangou, the field commander ",0
97,"Japan Issues Order to Deport Ex-Chess Champ Fischer  TOKYO (Reuters) - Japan on Tuesday ordered the deportation  of former world chess champion Bobby Fischer, wanted at home in  the United States for breaking sanctions, rejecting his demand  for protection as a political refugee.",0
98,"Eight children stabbed to death in China school A man armed with a knife has gone on the rampage and killed eight teenagers at a school in central China, teachers and local authorities said.",0
99,"S.Korea's Ruling Party Head Resigns on Father's Past  SEOUL (Reuters) - The chairman of South Korea's ruling Uri  Party resigned Thursday, an unexpected first casualty of  President Roh Moo-hyun's call for an inquiry into who benefited  from working with Korea's Japanese colonial rulers.",0
100,"After Delays, Milosevic Opens Defense  THE HAGUE, Aug. 31 -- Former Yugoslav president Slobodan Milosevic  launched on Tuesday a defiant defense of his conduct during the Balkan wars, accusing his enemies of conspiracies against the Serbs and insisting that his countrymen acted in self-defense.",0
101," #39;Suicide #39; theory over train crash LONDON, England -- Police investigating a train crash in southern England in which seven people died are focusing on a theory that a driver parked a car on the rails in an attempt to commit suicide.",0
102,"British Hostage Beheaded in Iraq, Insurgents Say British hostage Ken Bigley was beheaded near Baghdad on Thursday afternoon, insurgent sources in the rebel-held town of Falluja said on Friday.",0
103,"Fla. Senate Candidates Have Opposing Views (AP) AP - Republican Mel Martinez, hoping to become the first Cuban-American senator, criticized his opponent Monday for saying she would not have voted for the war in Iraq ""knowing what I know now."" The first debate between Martinez and Democrat Betty Castor comes as a new poll found Castor had erased the small gap between them.",0
104,"Basque separatists signal end to 35 years of conflict Spain #39;s banned Batasuna party, widely considered the political mouthpiece of the armed Basque separatist group Eta, offered last night to open a process of negotiations and dialogue to achieve peace in the Basque country.",0
