index,text,label
507,Notre Dame #39;s Willingham just had too many bad Saturdays There has been much talk over the past 36 hours about how Notre Dame and its football program are now no different from any number of other college football  #39;factories #39; littering the landscape.,1
508,"Sharapova Defeats Serena in WTA Final (AP) AP - Maria Sharapova overcame an early third-set mental lapse against an injured Serena Williams to win the WTA Championships 4-6, 6-2, 6-4 Monday night in a rematch of their Wimbledon final.",1
509,Angels ponder life without Guillen ANAHEIM ---- Angels management was so disturbed by Jose Guillen #39;s backlash at manager Mike Scioscia after Guillen was removed for a pinch runner Saturday that the team is willing to chase a playoff berth without its slugging left fielder.,1
510,Bourque inducted into NHL Hall of Fame Former Boston Bruin great Ray Bourque entered the Hockey Hall of Fame Monday. Not bad for a kid who just wanted to make a good impression as rookie in 1979.,1
511,Ten times two equals one NASCAR champ NASCAR's 2004 season has finally come to this: The Last Ten. And this: The Last Ten Men Standing.,1
512,"Backe Homers and Pitches Astros to Win (AP) AP - Houston Astros pitcher Brandon Backe got his first career homer, a two-run shot, and allowed one run in seven innings to keep the Astros in the thick of the NL wild-card chase with an 11-5 win over the Cincinnati Reds on Monday  #151; their season-high 10th straight victory.",1
513,Selig to get 3-year extension Major League Baseball #39;s owners will convene in Philadelphia today for two days of meetings that will culminate with a coronation of sorts. ,1
514,"Pampling struggles but maintains lead Irrespective of the conditions on day three of the Hillross Australian Open Championship, the Australian Golf Club #39;s layout was always going to provide a test of both game and character.",1
515,"Berdych Wins First ATP Title in Sicily (AP) AP - Tomas Berdych of the Czech Republic captured his first ATP title, defeating Filippo Volandri of Italy 6-3, 6-3 Sunday at the Campionati Internazionali di Sicilia.",1
516,"Ross out, and strip club manager says tailback passed stolen bills Ohio State senior tailback Lydell Ross will not play for the Buckeyes today in their homecoming game versus Indiana. Coach Jim Tressel would not comment Friday on Ross #39; suspension.",1
517,"Sports: Blue Jays announcer found dead in hotel room TORONTO Former Toronto pitcher John Cerutti (seh-ROO #39;-tee) was found dead in his hotel room today, according to the team. He was 44.",1
518,"Heskey left out of England squad, Cole back in England coach Sven-Goran Eriksson has left Emile Heskey out of his 23-man squad for the World Cup Group Six qualifiers away to Austria in Vienna next Saturday and Poland in Chorzow four days later.",1
519,Hewitt back in top form Lleyton Hewitt finished as the No. 1-ranked player in the world in 2001 and 2002 by running down more balls and winning more matches than anybody.,1
520,Gritty Sonics roll on SAN ANTONIO -- Antonio Daniels scowled and every muscle in his body seemed steel-cable taut as he walked toward the Sonics #39; bench.,1
521,"Second-Ranked Auburn Downs Alabama TUSCALOOSA, Ala. (Sports Network) - Jason Campbell passed for 224 yards and a touchdown, Courtney Taylor caught four passes for 89 yards and a score, and No.",1
522,"Clippers Defeat Warriors, 103-91 (AP) AP - Elton Brand scored six of his 25 points in the final four minutes and finished with 13 rebounds, leading the Los Angeles Clippers to a 103-91 victory over the Golden State Warriors on Sunday.",1
523,"Still Waiting for a New Home The MetroStars' telephone conference call after M.L.S.'s expansion draft was a lot like the team's disappointing season - snaps, crackles but ultimately no pop.",1
524,"Cheaters are still winners in the eyes of many fans On a gloriously sunny San Francisco day last April, a friend and I paid \$150 for tickets worth less than \$80 to see the San Francisco Giants play the Milwaukee Brewers at SBC Park. Of course, like thousands of others on that chilly Monday afternoon, we weren't there so much to see the game as to get a chance to ...",1
525,Cudicini on Wenger #39;s hit list Chelsea reserve keeper Carlo Cudicini has emerged as a possible transfer window target for Arsenal next month. The Italian has fallen behind Petr Cech in the pecking order at Stamford Bridge after the Czech stopper arrived at the club this summer.,1
526,Rugby-Ireland ring the changes ahead of US test Ireland coach Eddie O #39;Sullivan has rested flyhalf Ronan O #39;Gara as he juggles his squad for Saturday #39;s test against the United States at Lansdowne Road.,1
527,Angels' Eckstein Strengthened by Family (AP) AP - David Eckstein proved he could play in the majors despite being smaller than many batboys. He fought through injuries. He learned to hang tight on the plate with a 95 mph fastball coming at him.,1
528,"Blue Jays #39; Chacin wins debut in Yankee Stadium Gustavo Chacin walked into Yankee Stadium for the first time, looked around at the fans and the monuments and the pinstripes, and felt like any other nervous rookie.",1
529,British Grand Prix is rescued thanks to Mirror BRITAIN #39;S Silverstone Grand Prix was yesterday saved for the next five years after a Daily Mirror campaign. Formula One rights holder Bernie Ecclestone gave it a reprieve until 2009 by signing ,1
530,Quiet Man Hughes Will Do It his Way Mark Hughes today vowed that his understated style of management would not be compromised as he embraced the role of lifting Blackburn out of the Barclays Premiership relegation zone.,1
531,"Clemens #39; moment arrives in NLCS The lure of this moment is what made his retirement so short. A pennant on the line, an adopted city #39;s heart in his hands, a hostile stadium and swarming opponent.",1
532,Wilkinson Backs Woodward to Succeed World Cup-winning fly-half Jonny Wilkinson has no doubt former England coach Sir Clive Woodward will succeed in pursuing a new challenge in football.,1
533,"Kings Edge Lakers 109-106 (AP) AP - Peja Stojakovic scored 26 points and made four consecutive free throws in the closing seconds Friday night to lead the Sacramento Kings their seventh straight win, 109-106 over the Los Angeles Lakers.",1
534,Schilling Shines As Red Sox Rout White Sox (AP) AP - Curt Schilling allowed three hits in seven shutout innings for his 15th win and Manny Ramirez hit a grand slam to lead the Boston Red Sox over the Chicago White Sox 10-1 Friday night.,1
535,"Celtics best Knicks for seasons first win Paul Pierce scored 28 points, Ricky Davis added 20, and the Celtics shot 56 percent to win for the first time this season, crushing the New York Knicks 107-73 in the Saturdays home opener at Madison Square Garden.",1
536,"SportsNetwork Game Preview (Sports Network) - The Houston Astros have never won a playoff series in franchise history. Winners of 13 straight division titles, the Atlanta Braves are also hoping to break a Division Series jinx.",1
537,"Ferrari - Belgian Grand Prix  Spa-Francorchamps : Practice &lt;b&gt;...&lt;/b&gt; Jean Todt: It is a pleasure to be back at this circuit, which is probably the most interesting on the current Formula 1 calendar.",1
538,"Lockout threat looms over World Cup final As hard as the numerous NHL players gathered here tried to maintain focus on tonight #39;s World Cup of Hockey final, it was impossible to ignore the larger issue rumbling through their midst.",1
539,"Mourning Meets Ratner: Don't Ask Alonzo Mourning again shook things up when he questioned the Nets' new owner, Bruce C. Ratner, on his motive for purchasing the team.",1
540,"Texas to face Michigan in 91st Rose Bowl The Texas Longhorns will make their first BCS bowl appearance at the 91st Rose Bowl Game on Jan. 1, 2005, in Pasadena, Calif., at 3:30 pm.",1
541,Highlights of the college football weekend College football fans welcomed back the first full weekend of the season with plenty of excitement and storylines over a holiday weekend packed with action.,1
542,"Hard feelings likely to linger Parting with Syracuse and the Big East was such sweet sorrow for Boston College after the 17th-ranked Eagles, playing their final game as a Big East member, absorbed a ruinous 43-17 loss yesterday that prevented them from winning the conference title outright and clinching a Bowl Championship Series berth.",1
543,"Buckeyes screwed over by postseason ban Members of the new Ohio State basketball staff have worked on fixing their current team for nearly six months. From the outside, it hasn #39;t seemed that long, but it probably felt like a year or more to the ",1
544,"Bryant Prosecutors Say Some Data Tainted (AP) AP - Two days before the start of jury selection in Kobe Bryant's rape case, prosecutors charged that crucial DNA evidence the defense had hoped to use to prove the NBA star's innocence might have been contaminated.",1
545,Edwards Out of Games U.S. sprinter Torri Edwards is knocked out of the Olympics for good Tuesday when an arbitration panel upholds her two-year drug suspension.,1
546,"Storm 70, Lynx 58 Lauren Jackson scored 14 points to lead the Seattle Storm past the Minnesota Lynx 70-58 Saturday in the first game of their WNBA Western Conference semifinal series.",1
547,"Deion not ready for prime time Baltimore, MD (Sports Network) - The Baltimore Ravens will again be without cornerback Deion Sanders for the team #39;s nationally-televised Monday night battle against the Kansas City Chiefs.",1
548,"Inter crushes Anderlecht, leads group by three points Inter Milan beat Anderlecht 3-1 away to open a three-point lead in Champions League Group G on Wednesday. Obafemi Martins put Inter ahead in the ninth minute when he turned in a low left cross from fellow striker Adriano.",1
549,"NHL players meeting to discuss lockout Members of the NHL Players Association are meeting in Toronto today to discuss the seven-week-old hockey lockout. Some 70 to 80 player reps are expected at the meeting, who will then brief their teammates back home.",1
550,"USC, Oklahoma remain 1-2 in BCS;  #39;Canes and  #39;Noles plummet Philadelphia, PA (Sports Network) - Southern California and Oklahoma remained the top two teams in the Bowl Championship Series standings, while Miami- Florida and Florida State plummeted in the rankings after suffering surprising road losses on Saturday.",1
551,"Caborn in new talks to save grand prix The gloom over the threatened British grand prix started to lift yesterday when Sir Jackie Stewart confirmed that the minister for sport, Richard Caborn, is working with local authorities on ways of closing the gap between the fee demanded by Bernie ",1
552,"Ferrero leads Spanish slump in Madrid Holder Juan Carlos Ferrero has suffered a 6-3, 6-1 setback against a Peruvian with a bad ankle, crashing out listlessly in his opening match at the Madrid Masters.",1
553,Brady Helps Patriots Win Record 19th Straight  NEW YORK (Reuters) - Tom Brady threw two touchdown passes  to help the New England Patriots set a record for consecutive  victories by downing the winless Miami Dolphins 24-10 in  Foxboro Sunday.,1
554,Late goals boost Milan title hopes Kaka and Andrea Pirlo both scored in the last eight minutes to rally AC Milan to a 2-1 victory at rainy Parma on Saturday and move it within a point of Serie A leader Juventus.,1
555,"Herniated disk discovered in pitcher #39;s lower back The Florida Marlins have withdrawn their two-year, \$4.75 million offer to Antonio Alfonseca after a herniated disk was found in the pitcher #39;s lower back, the Miami Herald reported Friday.",1
556,UPDATE 2-Late Bouba Diop strike denies United A late equaliser from Pape Bouba Diop gave Fulham a 1-1 draw at home to Manchester United on Monday and prevented Alex Ferguson #39;s team from moving back into to the thick of the Premier League title race.,1
557,Notes: Kennedy lost for season The Angels suffered a huge blow to their playoff chances Tuesday when they learned that second baseman Adam Kennedy suffered a season-ending knee injury in Monday night #39;s game.,1
558,"Suns sign Japanese guard Tabuse Tabuse, who was waived after training camp with the Denver Nuggets last year, hopes to become the first Japanese-born player to make the NBA.",1
559,"Time to take care of business The Cubs didn #39;t need to fly anywhere near Florida to be in the eye of the storm. For a team that is going on 100 years since last winning a championship, the only thing they never are at a loss for is controversy.",1
560,LARSSON SUFFERS INJURY AGONY Barcelona striker Henrik Larsson is unlikely to play again this year because of a knee injury. The Sweden international had to be carried from the Nou Camp pitch during the second half of Saturday night #39;s ,1
561,"DC works to find stadium financing Advocates for preserving a major league baseball team in Washington, DC, said Friday that their strategy involves trying to convince DC Council chairwoman Linda W. Cropp that the city is committed to attracting private stadium financing on its own without ",1
562,"Successful, respected coach usually has last laugh Before we talk about the possibility Rick Majerus is the greatest coaching hire in USC sports history, let #39;s acknowledge that his arrival Wednesday raised a number of questions.",1
563,"Mussina, Matsui Set Up Game One Victory for Yankees Mike Mussina retired the first 19 batters he faced and Hideki Matsui drove in five runs as the New York Yankees opened the American League Championship Series with a wild 10-7 win over the Boston Red Sox Tuesday.",1
564,Moore battles back to top List at US amateur championship Ryan Moore staged a remarkable comeback to overhaul Luke List in the 36-hole final of the US amateur championship at the Winged Foot Golf Club on Sunday.,1
565,"Yankee fans forced to face harsh reality NEW YORK - They clung to hope that the Red Sox would choke at the last minute and once again fail to win the World Series, but when it didn't happen, some Yankees fans yesterday begrudgingly gave the Sox their due.",1
566,Coulthard eyes Williams DAVID COULTHARD has thrown his hat in the ring to fill Jenson Buttons void at Williams. Williams had expected Button to partner Mark Webber next season but were left looking for a new driver after Formula ,1
567,"Playing indoors will make for a different game in West Final, says &lt;b&gt;...&lt;/b&gt; VANCOUVER (CP) - Wally Buono expects a different game when the Saskatchewan Roughriders come in from the cold to face the BC Lions in Sunday #39;s CFL West Final.",1
568,"CSKA Moscow overcome PSG CSKA Moscow continued their bright start to Group H of the Champions League tonight with a victory against PSG. Sergei Semak scored after 64 minutes for the Russian side, and he was instrumental in CSKA #39;s second as he was taken down.",1
569,"Prasar Bharti to challenge BCCI decision in Supreme Court New Delhi, Oct. 1 (PTI): Stung by the BCCI decision to award telecast rights for the India-Australia Test series to Sony TV, Prasar Bharti today said it would challenge the decision in Supreme Court.",1
570,JFK assassination  #39;game #39; stirs up controversy A PC game produced by Scottish firm Traffic Games has come under fire from the family of former US president John F Kennedy for allowing gamers to play through his assassination as sniper Lee Harvey Oswald.,1
571,"Drogba faces UEFA punishment Chelsea manager Jose Mourinho has urged European football #39;s governing body, UEFA, not to punish star striker Didier Drogba for taunting Paris Saint-Germain fans on Tuesday.",1
572,Exclusive to pgatour.com.au/Sportal Peter Lonard was almost an afterthought last week at The Australian - until the last nine when his pressure-proof action flushed enough irons close enough to steal the championship from those who had borne the brunt of the leaders #39; tension for three and a ,1
573,Plenty of options for Washington The No. 2 Oklahoma Sooners would like the poll voters out there to understand just how difficult a task they accomplished Saturday.,1
574,"Atlanta Braves, Smoltz Agree to New Deal  ATLANTA (Sports Network) - The Atlanta Braves announced  Thursday that the team has come to terms with longtime pitcher  John Smoltz to a new two-year contract with a club option for  the 2007 season. Per club policy, financial terms were not  disclosed.",1
575,No rest as Holmes returns for heats Kelly Holmes was due back in the Olympic stadium on Tuesday evening less than 24 hours after becoming the first British woman to win gold in the 800metres for 40 years.,1
576,"American Peirsol, Australian Hanson excel at world championships Peirsol plays a part in 2 world records: Aaron Peirsol of Irvine, Calif., lowered his world record in the 200-meter backstroke at the short-course world championships, which ended last night in Indianapolis.",1
577,"Beckham praised for lifting listless Real Madrid David Beckham #39;s goal against Primera Liga newcomer Numancia was the highlight of Real Madrid #39;s first league outing in the Santiago Bernabeu Stadium this season, according to the country #39;s sports press Sunday.",1
578,"Tranghese offers new BCS plan Big East commissioner Mike Tranghese is pushing a plan to change the way teams are selected for the Bowl Championship Series and make the process, which has been marked by controversy since its inception in 1998, more in line with the way the NCAA picks teams for its basketball tournament.",1
579,"Russia beat France to win its first Fed Cup Russia edged defending champion France 3-2 to claim its first Fed Cup title Sunday, with Anastasia Myskina and Vera Zvonareva beating Marion Bartoli and Emilie Loit 7-6 (5), 7-5 in the decisive doubles match.",1
580,New model Safin rediscovers hot shots One of the best things that could happen to tennis would be for Marat Safin to return consistently to the form that enabled him to capture the 2000 US Open title - and at last there were signs of this yesterday as the charismatic Russian won his first ,1
581,"Rain eases to showers ahead of one-day decider Rain is continuing to fall around Brisbane, threatening the deciding match in the Chappell-Hadlee one day series between Australia and New Zealand.",1
582,"Racing: Consortium claims it has agreed terms to keep Silverstone &lt;b&gt;...&lt;/b&gt; LONDON : A consortium, including former world champion Nigel Mansell, claims it has agreed terms to ensure Silverstone remains one of the venues for the 2005 Formula One world championship.",1
583,"Steelers' Bell Out for at Least Two Weeks (AP) AP - In his fourth NFL season, Kendrell Bell is reliving his sophomore jinx. The playmaking inside linebacker for the Pittsburgh Steelers will miss at least the next two games with what is now being called a sports hernia.",1
584,"Defender to miss extra game NEW YORK -- Already hit with an automatic one-game suspension and a \$250 fine for drawing a red card, Kansas City Wizards defender Alex Zotinca has been issued an additional fine and suspension.",1
585,"Giambi testified about his steroid use Ripping the shroud further off one of baseball's dirty secrets, Yankees slugger Jason Giambi testified before a federal grand jury that he used performance-enhancing human growth hormone in 2003 and illegal steroids for at least three seasons, the San Francisco Chronicle reported yesterday, citing a transcript of the court proceedings.",1
586,Canas seals third title Guillermo Canas wrapped up the Shanghai Open title with consummate ease on Sunday following a 6-1 6-0 win against Lars Burgsmuller.,1
587,INDIA TOUR GIVEN GO-AHEAD India #39;s two-Test series in Bangladesh will go ahead after concerns over security issues were allayed. A militant group had vowed to kill the Indian players if they came to Dhaka but that threat has now been dismissed as a hoax.,1
588,"Canas in finals of the Shanghai Open Guillermo Canas booked his third finals appearance of the season with a 6-1, 6-2 victory yesterday over a faltering Jiri Novak at the Shanghai Open.",1
589,Bowden lands slugger Guillen Jim Bowden continued to lead the hot stove league in deals yesterday when Washington #39;s interim general manager acquired power hitter and problem child Jose Guillen in a trade that sent two ,1
590,"NHL's Kovalev Bolsters Already Potent Kazan Lineup  KAZAN, Russia (Sports Network) - Russian forward Alexei  Kovalev is the latest locked out National Hockey League player  to head abroad, as he signed on to play for AK Bars Kazan.",1
591,"Matsui breaks out of slump as Yankees thrash Rays NEW YORK - Hideki Matsui produced three hits with two RBIs Tuesday and snapped an 0-for-16 slump, helping the Yankees crush the Devil Rays 11-2.",1
592,"Spurs Hold Off Sixers Tim Duncan scores a season-high 34 points and grabs 13 rebounds to lead the Spurs to their fifth straight victory, 88-80, over the 76ers.",1
593,Motorsport: Solberg #39;s stage hat-trick PETTER SOLBERG and Welsh co-driver Phil Mills reeled in Wales Rally GB leader Sebastien Loeb with a stage win hat-trick yesterday.,1
594,"Illini a 4-star hoops power CHAMPAIGN -- ESPN #39;s Jay Bilas said Deron Williams, the Big Ten #39;s Preseason Player of the Year, wouldn #39;t rank in the top 10 in the ACC.",1
595,"Camacho ready to quit as Real coach - reports Real Madrid coach Jose Antonio Camacho offered his resignation to club president Florentino Perez on Sunday, Spanish state radio reported.",1
596,"Officials try to convince Turin Games chief organizer to stay Government officials are trying to convince the chief organizer of the 2006 Turin Olympics not to quit, but Valentino Castellani says there is  quot;no room for second thoughts.",1
597,Johnson receives a message with benching Bethel Johnson remains in the dark on why Patriots coach Bill Belichick decided the second-year wide receiver out of Texas A amp;M should have been kept off the 45-man active roster for last Sunday's win over the Dolphins.,1
598,Barea sparks Huskies Northeastern and Binghamton were locked in a back-and-forth struggle before Jose Juan Barea took charge. The junior guard scored 15 of his game-high 28 points in the final five minutes to lead the Huskies to a 75-68 victory at Solomon Court yesterday.,1
599,"Another Palmer Charges to Victory  The name was familiar. So was the charge.&lt;br&gt; The highlight of Ryan Palmer's rookie season on the PGA Tour came seven months ago across town at Bay Hill, when he met Arnold Palmer for the first time. That changed yesterday in the Funai Classic, where the 28-year-old rookie made a name for...",1
600,"Rams Win 23-12, Top NFC West With Seattle (AP) AP - Marc Bulger got off to a red-hot start and a beleaguered defense held Seattle to three field goals in five trips inside the 20 in a 23-12 victory that earned the St. Louis Rams a first-place tie with the Seahawks in the NFC West on Sunday.",1
601,"Keeping frustrations in reserve Jiri Welsch may vent his frustrations in Czech on the court, but his body language during games and unusually short answers to questions after practice yesterday need no translation. Although a team player, Welsch has been frustrated with his second-unit duties. In a system suited to his abilities and basketball intelligence, Welsch has struggled to make meaningful contributions, ...",1
602,"Former Greats Lament TV Deal Two former England captains today bemoaned the loss of cricket to Britains living rooms, claiming the sports new television deal had turned its back on thousands of potential future players.",1
603,Soccer Racism Taints Spain's Reputation (AP) AP - Spaniards used to say they lived in one of Europe's most racially tolerant countries. Soccer has shattered that myth. In Madrid's Santiago Bernabeu stadium  #151; the Yankee Stadium of soccer  #151; Spanish fans bellowed out monkey noises last week each time a black English player touched the ball in a match between England and Spain.,1
604,Maine holds on to strike it rich Josh Radulski made a sliding touchdown catch with 5:56 remaining yesterday and Maine stopped a fourth-down play at its 20-yard line in the closing minutes as the Black Bears held on for a 29-25 Atlantic 10 victory at Richmond.,1
605,"United States 3, Slovakia 1 Team USA finally showed some energy in the World Cup of Hockey, beating Slovakia 3-1 Friday for its first win in the tournament. Bill Guerin, Jason Blake and Bryan Smolinski scored for the younger, quicker ",1
606,"Games go eons back in time today ATHENS, Greece  The slogan for these Olympics is,  quot;Welcome Home. quot; But the Games really go home today, when the men #39;s and women #39;s shot put are held in the excavated stadium of ancient Olympia, which started all this madness in 776 BC ...",1
607,"Jets remain unbeaten The New York Jets are 4-0 for the second time in their 45-year history, but they know that the road ahead is bound to be more difficult to travel.",1
608,Owens in spotlight quickly with Eagles The City of Brotherly Love does not shower affection as freely as its moniker suggests. Philadelphia fanatics booed when the Eagles took quarterback Donovan McNabb second overall ,1
609,"Suggs to Practice Cleveland Browns running back Lee Suggs has been cleared by doctors to return to practice this week. However, there is still some haziness about his medical condition.",1
610,Rugby union-Lomu still hopeful of return to action Former All Black winger Jonah Lomu says he is still hopeful of a return to competitive rugby following his kidney transplant earlier this year.,1
611,"Hewitt, Sluiter, Muller Win at Legg Mason (AP) AP - Lleyton Hewitt breezed to a 6-1, 6-2 win over Kenneth Carlsen Monday night in the first round of the Legg Mason Tennis Classic.",1
612,"Shot-Put Returns to Ancient Stadium THENS, Aug. 17  American shot-putter John Godina walked into the ancient Olympic stadium at Olympia when he arrived there earlier this week and the history he had studied in college came to life before his eyes. ",1
