index,text,label
1468,Snow says cutting trade deficit a priority Treasury Secretary John Snow said Wednesday cutting the US current account deficit will be a top priority for the Bush administration #39;s second term.,2
1469,"A naming-rights offer writ small Corporate donors who couldn't afford to pony up millions a year to affix their brand names to Gillette Stadium or the FleetCenter might consider this: For a mere \$200,000, they can now buy the naming rights to a performance studio at a Worcester radio station.",2
1470,Crude-oil futures surge to over \$53 NEW YORK - Crude-oil futures rallied back above \$53 late on Wednesday on speculation and panic sparked by an oil-line explosion in Mexico.,2
1471,"UPDATE 1-Bush touts tax cuts, aide acknowledges  #39;soft patch #39; US President George W. Bush said on Saturday his tax cuts were working to lift growth but a senior aide acknowledged that the economy hit a  quot;soft patch quot; over the last six or eight weeks.",2
1472,"Stocks Drift Down in Ultra-Light Volume  NEW YORK (Reuters) - U.S. stocks slid lower in ultra-light  volume on Monday, as security concerns surrounding the  Republican convention in New York kept investors on the  sidelines.",2
1473,"Owens-Illinois to Sell European Plants Owens-Illinois Inc., the world #39;s largest manufacturer of glass containers, on Thursday said it will sell two of its plants in Europe to Spanish rival Vidrala SA in a \$179 million deal.",2
1474,"Emerson may not have pull in bank mergers Canada #39;s business community may have found a well-placed advocate at the cabinet table in David Emerson, but that doesn #39;t mean the new federal Industry Minister will necessarily carry the day on bank mergers.",2
1475,Stocks Set to Open Lower; Greenspan Eyed  NEW YORK (Reuters) - U.S. stocks were headed lower on  Wednesday as investors await remarks by Federal Reserve  Chairman Alan Greenspan and may take some profits a day after  major indexes rose to 2-month highs.,2
1476,"Stocks Open Flat, Earnings News Mixed (Reuters) Reuters - U.S. stocks opened near unchanged on\Friday after mixed corporate results showed Web search company\Google Inc.   had better-than-forecast earnings, but\software maker Microsoft Corp.  gave a revenue forecast\that lagged Wall Street expectations.",2
1477,"Fonterra says no need to raise National Foods bid SYDNEY, NOV 28: New Zealand dairy giant Fonterra said on Sunday it would only raise its A\$1.6 billion (\$1.3 billion) bid for Australias top milk producer, National Foods Ltd, in the unlikely event that a rival suitor emerged.",2
1478,BRUSSELS:  quot;No Going Back quot; In Elimination Of WTO Quotas The European Union council has officially adopted a proposal to eliminate all quantitative restrictions on the import of textile and clothing from World Trade Organisation countries from 1 January 2005.,2
1479,Tauzin to Head Pharmaceutical Lobbying Group Retiring Rep. Billy Tauzin will become head of the pharmaceutical industry's top lobbying group next month after leaving his post as head of the House committee that regulates the pharmaceutical industry.,2
1480,"Oracle to PeopleSoft: Drop Poison Pill (Reuters) Reuters - Oracle Corp. on Monday again\asked PeopleSoft Inc.'s board of directors to rescind an\anti-takeover provision, as the two business software makers\prepared to return to court this week to address one of the\final barriers to the  #36;9.2-billion takeover bid.",2
1481,Stocks Seen Flat with Oil Above \$52  NEW YORK (Reuters) - U.S. stocks looked to open flat on  Thursday under pressure from the surge in oil prices and  lackluster September sales reports from U.S. retailers.,2
1482,Critics: Legalization will lead to job losses Opponents of importing prescription drugs from Canada are introducing a new argument to the debate with studies that say it would wipe out thousands of jobs in states like Massachusetts that depend on pharmaceutical and biotechnology research.,2
1483,"Fed on Tightening Path, Unfazed by Oil (Reuters) Reuters - The surge in oil prices over the\summer was not enough to derail the U.S. economy and the\central bank sees no reason to pause in its interest-rate rises\just yet, top Fed officials said on Thursday.",2
1484,Treasuries Slip on Payroll Data  NEW YORK (Reuters) - U.S. Treasury debt prices slipped on  Friday as the long-awaited August jobs report showed enough of  a rise to cement market expectations for further rate hikes  from the Federal Reserve.,2
1485,"Bush to tout economic trend in NYC WASHINGTON (CBS.MW) -- Through thick and thin, President Bush has consistently extolled the virtues of lowering taxes to make the economy stronger.",2
1486,Arthritis sufferers at a loss Arthritis sufferers across South Africa have been inundating call centres and pharmacists in the wake of the shock withdrawal of their medication by the manufacturers of the most widely used drug treating the disease.,2
1487,"American, Boeing Agree to Delay 54 Plane Deliveries (Update4) AMR Corp. #39;s American Airlines, the world #39;s largest carrier, delayed the deliveries of 54 Boeing Co. planes to save \$2.7 billion in spending over the next six years.",2
1488,"Cendant Makes Its Move on Diller By nabbing Orbitz in a pricey deal, Henry Silverman #39;s outfit will now go head-to-head against InterActiveCorp in online travel.",2
1489,US trade gap balloons The US trade deficit widens to fresh record levels after higher oil prices raise the cost of imports.,2
1490,"Disney begins new CEO hunt Bowing to pressure from investors, Disney #39;s board of directors said yesterday that it expects to name a successor to embattled Disney chief Michael Eisner by next June.",2
1491,"LNM Plans to Merge Two Main Divisions Privately-owned Dutch steelmaker LNM Group said Monday it plans to merge its two main divisions, Ispat International NV and LNM Holdings NV, and then take over US-based International Steel Group, which would make it the largest steel company in the world.",2
1492,"Small Business Optimism Still Strong (Reuters) Reuters - U.S. small business optimism dipped\slightly last month but remained near record levels, suggesting\a strong outlook for growth, a survey released on Tuesday\showed.",2
1493,"Stocks Near Flat; J J Pressures Dow  NEW YORK (Reuters) - U.S. stocks were little changed on  Tuesday, with oil prices dropping below \$42 a barrel helping to  support markets, but Johnson   Johnson &lt;A HREF=""http://www.investor.reuters.com/FullQuote.aspx?ticker=JNJ.N target=/stocks/quickinfo/fullquote""&gt;JNJ.N&lt;/A&gt; put pressure on  the Dow following a report of a possible \$24 billion takeover  of cardiovascular device maker Guidant Corp. &lt;A HREF=""http://www.investor.reuters.com/FullQuote.aspx?ticker=GDT.N target=/stocks/quickinfo/fullquote""&gt;GDT.N&lt;/A&gt;.",2
1494,"Forecast maps on trackfor new look Instead of the skinny black line, showing a hurricane #39;s forecast track, forecasters have drafted a couple of alternative graphics to depict where the storms might go -- and they want your opinion.",2
1495,"US jobs growth weaker than expected US businesses added 96,000 jobs to payrolls in September, the government has reported, a weaker-than-expected total that is expected to sharpen a presidential debate later in the day over the economy #39;s direction.",2
1496,"Smithfield Foods Reports Higher Profit Smithfield Foods Inc. (SFD.N: Quote, Profile, Research) , the largest US hog and pork producer, on Tuesday reported higher fiscal second-quarter profit due to strong hog prices and the acquisition last year of Farmland Foods.",2
1497,"German business confidence stable despite high oil prices, strong euro (AFP) AFP - German business confidence braved surging oil prices and the strong euro to remain stable in October, a widely watched barometer of industrial confidence in the eurozone's biggest economy showed.",2
1498,"Baltimore Ranks High In Dangerous Cities List TRENTON, NJ -- Camden, NJ, has been named the nation #39;s most-dangerous metropolitan area, snatching the top spot from Detroit. The rankings were based in crime statistics compiled by Morgan Quitno Corporation ",2
1499,"Hynix accused of \$1.7 billion 1999 accounting fraud SEOUL, South Korea - Hynix Semiconductor Inc., formerly Hyundai Electronics, is alleged to have committed an accounting miss-statement of nearly 2 trillion won (about US\$1.",2
1500,Verizon Wireless brings 3G to more cities Nation's largest wireless carrier says it's leading the race to cover the United States with a third-generation network.,3
1501,"Undaunted PeopleSoft rolls out business apps Although the threat of Oracles hostile takeover continues to cast a shadow over it, PeopleSoft is pressing on with plans to integrate into its product mix the enterprise applications it picked up last year in its acquisition of J.D. Edwards.",3
1502,"US Spammer Facing Nine Years in Jail It is believed that with the help of his sister, Jessica DeGroot, 28, who was fined US\$7,500, Jeremy Jaynes pedalled non-existent products via email such as a  quot;FedEx refund processor quot; that supposedly ",3
1503,"California Cities, Counties Sue Microsoft Microsoft (MSFT:Nasdaq - news - research) is being sued by several California cities and counties, which accuse the company of charging inflated prices due to its alleged monopoly control of the PC operating system market.",3
1504,"YAHOO! Unveils Personal Search Beta Yahoo! Inc. (Nasdaq:YHOO - News), a leading global Internet company, announced yesterday the availability of the My Yahoo! Search beta (http://next.",3
1505,"Virus writer gets security job Virus writer Sven Jaschan, who claimed responsibility for the Sasser and Netsky worms, has been given a job at an internet security company.",3
1506,"A new handshake for mini hard drives? Intel, Hitachi, Toshiba and others propose CE-ATA, a new interface for miniature hard drives used in consumer electronics.",3
1507,"Rising Sun for Ingram Micro (The Motley Fool) The Motley Fool - Information technology spending is growing significantly -- that is, in other countries such as China and India. According to an IDC study, China's IT growth is expected to be 15 annually and India's about 20.",3
1508,"Apple iTunes Rocks Europe  quot;We #39;re excited to bring the iTunes Music Store to even more music fans across Europe, and with this expansion we now reach customers in almost 70 percent of the global music market, quot; Apple #39;s Vice President of Applications Eddy Cue said.",3
1509,"Gates: Microsoft To Test MSN Spaces Blog Thursday Vox populi, 2004 style. Microsoft (nasdaq: MSFT - news - people ) on Wednesday said it will offer blogging to the online many-headed.",3
1510,"Next Space Station Launch Set for Oct 11 The blast-off in a Soyuz spacecraft from Russia #39;s Baikonur cosmodrome in Kazakhstan will deploy a replacement crew for Russian cosmonaut Gennady Padalka and NASA astronaut Michael Fincke, who have manned the orbital platform since April.",3
1511,"Oracle Extends Offer for PeopleSoft (Reuters) Reuters - Business software maker  Oracle\Corp. (ORCL.O) said on Thursday it extended again its  #36;7.7\billion hostile tender offer for PeopleSoft Inc. (PSFT.O), to\Sept. 10, as it awaits a U.S. District Court judge's ruling on\whether the takeover attempt can move forward.",3
1512,"Shuttle Enterprise takes center stage Space shuttle Enterprise was born to be an astronautical bridesmaid, never a bride. Built in 1976 as one of the first trio of US shuttles, Enterprise never left Earth #39;s atmosphere ",3
1513,"Shatner Wants to Boldly Go on Space Flight Actor William Shatner is shown in this undated publicity photo. (AP Photo/www.williamshatner.com). LONDON Oct 22, 2004 -  quot;Star Trek quot; star William Shatner and Red Hot Chili Peppers drummer Dave Navarro are ",3
1514,"Study: Global Warming Could Change Calif. (AP) AP - Global warming could cause dramatically hotter summers and a depleted snow pack in California, leading to a sharp increase in heat-related deaths and jeopardizing the water supply, according to a study released Monday.",3
1515,Are Desktop Search Programs Ready for Prime Time? (PC World) PC World - Copernic Desktop Search does the work without Google's security flaws.,3
1516,"Gartner, IDC have different takes on Q3 PC market Warm or hot? What you believe about the state of worldwide PC shipments in Q3 depends on who you listen to. According to Gartner, Inc.",3
1517,"MS launches XP lite for Indian market NEW DELHI: Microsoft has announced its simplified and low-priced version of Windows XP for India and has tied up with leading PC vendors including HCL, HP, Wipro and Acer to bring PCs at significantly lower prices.",3
1518,"AT amp;T Offers IM, Email and Text Messaging On The Go At an affordable device price of \$99 (after \$30 mail-in rebate) with unlimited messaging plans starting at only \$17.99 per month, Ogo provides customers with a wireless messaging device priced for the typical consumer.",3
1519,OutKast tops first digital-music sales awards Hip-hip duo OutKast have taken top honours as the recording industry handed out its first awards for music sold through Internet-music services like Apple Computer Inc.,3
1520,"Shuttle's Spring 2005 Launch Date Delayed (AP) AP - NASA's spaceflight leadership council decided Friday to delay the spring 2005 launch date for the first shuttle scheduled to return to space since last year's Columbia tragedy, citing hurricane damage and more work needed to meet a panel's recommendations.",3
1521," #39;Hobbit #39; find raises debate on humanity SYDNEY - The discovery of a skeleton of a female barely one metre tall who hunted pygmy elephants and giant rats 18000 years ago could force a reassessment of the origins of humanity, scientists in Australia said yesterday.",3
1522,"Google's New PC Search Tool Poses Risks (AP) AP - People who use public or workplace computers for e-mail, instant messaging and Web searching have a new security risk to worry about: Google's free new tool that indexes a PC's contents for quickly locating data.",3
1523,VeriSign dealt another legal blow in ICANN suit VeriSign Inc. lost another round in its battle against the Internet Corporation for Assigned Names and Numbers (ICANN) on Thursday when a US federal judge dismissed the ,3
1524,"Group to Propose New High-Speed Wireless Format  LOS ANGELES (Reuters) - A group of technology companies  including Texas Instruments Inc. &lt;A HREF=""http://www.reuters.co.uk/financeQuoteLookup.jhtml?ticker=TXN.N qtype=sym infotype=info qcat=news""&gt;TXN.N&lt;/A&gt;, STMicroelectronics  &lt;A HREF=""http://www.reuters.co.uk/financeQuoteLookup.jhtml?ticker=STM.PA qtype=sym infotype=info qcat=news""&gt;STM.PA&lt;/A&gt; and Broadcom Corp. &lt;A HREF=""http://www.reuters.co.uk/financeQuoteLookup.jhtml?ticker=BRCM.O qtype=sym infotype=info qcat=news""&gt;BRCM.O&lt;/A&gt;, on Thursday said they  will propose a new wireless networking standard up to 10 times  the speed of the current generation.",3
1525,"N.C. Co. Develops Germ-Fighting Clothes (AP) AP - Deep in the Atlantic Ocean, undersea explorers are living a safer life thanks to germ-fighting clothing made in Kinston.",3
1526,"Wealthy New Lab Aims to Capture Dreams, Literally (Reuters) Reuters - Gerald Rubin is looking for\someone who can take a picture of a thought.",3
1527,"Now Showing at Apple: The Return of Mr. Jobs Steven P. Jobs, founder of Apple, unveiled a new line of miniretail stores, making his first appearance since cancer surgery.",3
1528,"Zafi Slows, But Experts Urge Vigilance The Zafi.d worm seems to have done its worst, security experts say, but they urged users to remain on guard through the holidays for more seasonal shenanigans.",3
1529,"PalmOne Extends Treo on the High End Palmone Inc. this week will unveil the Treo 650 smart phone, although the phone likely will not be available from carriers until later this fall.",3
1530,"Wiki start-up JotSpot draws crowd for product beta Nearly 3,000 companies have signed up for test accounts to try a beta version of its wiki application for Web-based collaboration. ",3
1531,"Running Extra Mile Sets Humans Apart in Primates #39; World If walking upright first set early human ancestors apart from their ape cousins, it may have been their eventual ability to run long distances with a springing step over the African savanna ",3
1532,"Mobile Phones Increase Tumor Risk, Study Says  STOCKHOLM (Reuters) - Ten or more years of mobile phone use  increases the risk of developing acoustic neuroma, a benign  tumor on the auditory nerve, according to a study released on  Wednesday by Sweden's Karolinska Institute.",3
1533,"SANYO to Adopt HD DVD Standard to Develop Next Generation DVDs TOKYO --(Business Wire)-- Aug. 31, 2004 -- SANYO Electric Co., Ltd. (SANYO) has decided to adopt the HD DVD standard promoted in the DVD forum, an international association that brings together some 220 consumer ",3
1534,IBM Shark Sales Sink IBM last week announced new high-end and midrange systems that executives said could double the company #39;s market share in external disk by 2008 (see IBM #39;s New Shark Tale).,3
1535,"Bio Data-Cruncher Hits Jackpot A Harvard biologist scores on three fronts with a genetic discovery in diabetes, an advance toward curing a rare children's disease and a \$500,000 award for scientific creativity. Fifth in a series profiling the MacArthur Foundation 'genius award' winners. By Kari Lynn Dean.",3
1536,"Audubon: Some Iowa birds in trouble The survival of some Iowa bird species is threatened, primarily because of habitat loss, according to a group dedicated to the conservation of wild birds.",3
1537,"IBM signs seven-year deal with Lloyds TSB IBM Corp has signed a seven-year deal to manage the voice and data services of London, UK-based financial institution Lloyds TSB. The contract is estimated to be worth \$972.5 million.",3
1538,"Search Engine Marketing Issues - Link Popularity Search Engine Marketing Issues - Link Popularity\\For years, ""link popularity"" and ""Google PageRank"" have been the talk of the town in the search engine optimization community. However, the definition of link popularity and how it differs from PageRank (PR), as well as how much effect these actually have on search ...",3
1539,"Marsh Grass Threatens Plants in S.F. Bay (AP) AP - An exotic marsh grass is spreading throughout San Francisco Bay more rapidly than anticipated, threatening native plants and birds and prompting an urgent search for ways to eradicate it.",3
1540,"Samsung to Launch Phone with Mini Hard Drive (Reuters) Reuters - Samsung Electronics Co. Ltd., the world's\third-largest handset maker, said on Tuesday it was launching\the first mobile phone with a stamp-sized hard disc drive this\month that would expand the memory capacity by 15 times.",3
1541,"Microsoft, IE and Bloat \\Zawodny  threads off of Scoble  on the IE issue:\\""I have to say, when I first read that I nearly fell off my chair laughing. I was\thinking ""how stupid ARE these IE guys?!?!?!"" But we all know that Microsoft is\full of smart people who care about what they're doing. So something really\doesn't compute here.""\\""Last time I checked, IE wasn't even close to feature parity with Mozilla's\browsers. No popup blocking, no tabbed browsing, etc.""\\""Does the IE team really not know what their product is missing?""\\Perhaps.  It's highly likely that they just don't know.\\The bigger issue here is that Microsoft products can't fail and they can't\succeed.  Microsoft has 40-50 billion in the bank.  There ...\\",3
1542,"Protecting your Windows PC, Part 1 Protecting your computer doesn #39;t have to be a life-changing experience. But you do need to be more careful now than ever before.",3
1543,Music Industry To Sue  #39;Major File-Sharers #39; British record companies trade association the BPI (British Phonographic Industry) has announced it is to begin a rolling programme of legal action against  #39;major filesharers #39; who illegally make copyright music available to millions of people across the ,3
1544,"Singingfish Unveils Multimedia Search Tool Consumers will be able to hunt for music, movies, news, and more.",3
1545,"Microsoft wants servers to drive Office sales Microsoft wants to create closer ties between its Office desktop software and its server applications in the next version of Office, hoping customers will upgrade their copies of the dominant desktop software suite.",3
1546,"Netline strikes deal with Novell Netline Internet Service on Thursday announced that Novell has agreed to provide global training, maintenance, and support for its Open-Xchange Server product.",3
1547,WiMAX just hype for now?  quot;These applications will not be large enough to sustain the multitude of silicon suppliers and equipment manufacturers who have expressed interest in developing products for WiMAX.,3
1548,"Masai, Whites and Wildlife: No Peaceable Kingdom Masai herders in Kenya have begun cutting fences and marching their livestock onto the private ranchland of white settlers, where wildlife thrives.",3
1549,"Jamaica to provide Internet access to poor communities Jamaica #39;s government says it plans to provide free Internet access in poor communities across the island. The e-Jamaica initiative will establish 60 Internet centres across the country by 2010, mostly in post offices.",3
1550,"Moon gas could meet Earth #39;s future energy demands: Scientists A potential gas source found on the Moon #39;s surface could hold the key to meeting future energy demands as the Earth #39;s fossil fuels dry up in the coming decades, scientists said on Friday.",3
1551,"T-Mobile tries start-up #39;s wireless technology European cell phone giant T-Mobile International said Wednesday that it #39;s conducting a trial of super-fast wireless broadband gear from Flarion Technologies, giving the New Jersey start-up its first step into the European broadband market.",3
1552,Bluetooth Version 2.0 Enhanced Data Rate Announced The Bluetooth Special Interest Group (SIG) today announced the adoption of Bluetooth Core Specification Version 2.0  EDR (Enhanced Data Rate).,3
1553,"Intel admits Itanium pains, plots server future &lt;strong&gt;IDF Fall '04&lt;/strong&gt; Welcome Whitefield",3
1554,"eBay, Macromedia, deal p2pnet.net News:- eBay has gone from being an online community founded in 1995 so people could sell things to each other, to a vast, multi-national virtual monopoly where the dollar and the bottom line rule.",3
1555,"In Search Of Open-Source Experts As companies ramp up open-source deployments, expertise is in high demand and short supply. The costs of developing talent can add up.",3
1556,Sun loses Java case p2pnet.net News:- Eastman Kodak is looking for \$1.06 billion in damages from Sun Microsystems following a federal jury ruling in its favour.,3
1557,"Blog Creation, Readership Rise in 2004 Readership of online journals known as blogs grew significantly in 2004, driven by increased awareness of them during the presidential campaign and other major news events, according to a study released Sunday.",3
1558,"Congress Puts Hooks in Spyware, Copyright Crooks (washingtonpost.com) washingtonpost.com - Congressional lawmakers are taking a cue from Hollywood with an aim to beef up penalties against people who illegally swap copyrighted movies and songs over the Internet. Meanwhile, lawmakers also are targeting spyware and hackers with the threat of jail time for evil cyberspace deeds.",3
1559,"Snubbing the RIAA, Part II A long time ago (or so it seems), I wrote Snubbing the RIAA, Part I, in an attempt to provide some sources of non-RIAA backed music to the readers of K5.  What follows is Part II, in which I present some more sources of great music, and some ways to tell if your favourite artist belongs to an RIAA-member label.",3
1560,"Digital Agenda: Homeland Security The homeland security boom is funneling billions of dollars to antiterror tech makers, problems with accountability and coordination. A News.com special series.",3
1561,"Product Previews (InfoWorld) InfoWorld - Adobe unveils Acrobat 7.0\Adobe Systems has launched Version 7.0 of its Acrobat family of desktop applications. Enhancements to the software allow users to leverage Acrobat 7.0 and Adobe PDF for processes such as assembling documents from multiple sources, creating forms, and secure collaboration. Acrobat 7.0 tightens integration with Adobe LiveCycle software for connecting document services with businesses processes. The integration allows Acrobat 7.0 Professional users to create XML and PDF forms that can be integrated into back-end systems. Also announced was Adobe Reader 7.0 client software, which facilitates Reader users #8217; participation in document reviews and access to Yahoo Search functions. Acrobat 7.0 Professional is priced at  #36;449; existing users can upgrade for  #36;159. Acrobat 7.0 Standard is priced at  #36;299; upgrades are priced at  #36;99.\Acrobat 7.0, Adobe Systems",3
1562,Smithsonian Unveils Ocean Science Program (AP) AP - A new ocean science program dedicated to studying and explaining the world's oceans is the latest offering from the Smithsonian Institution's National Museum of Natural History.,3
1563,"Philly Broadband Clash Pits City Against Telcos (Reuters) Reuters - Philadelphia officials have laid the\groundwork to provide wireless, high-speed Internet access\anywhere in the city, but their plan could be scotched under a\state bill that could be signed into law on Tuesday.",3
1564,Photo 6 of 8: Global gamers clash for cash \$2.5 million in prize money is on the line as gamers from Uzbekistan to Ecuador compete in the World Cyber Games.,3
1565,"Microsoft skips Itanium with new Windows Microsoft will come out with a special version of Windows next year for clusters, but it won #39;t run on Intel #39;s most powerful server chip, at least for now.",3
