index,text,label
1051,Adtranz price slashed 30 as Bombardier settles with &lt;b&gt;...&lt;/b&gt; MONTREAL (CP) - Bombardier Inc. will get a \$209-million-US reduction in the price it paid DaimlerChrysler AG in 2001 for the German company #39;s rail equipment division.,2
1052,"Tokyo Stocks Open Lower on Oil, Economy (Reuters) Reuters - Tokyo's Nikkei average opened down 0.29\percent on Monday with airlines, exporters and banks under\selling pressure amid growing worries about higher oil prices\and the domestic economic outlook.",2
1053,Options-expense rule put off until June The US Financial Accounting Standards Board agreed to delay by six months implementation of a rule that will force companies to treat employee stock options as an expense.,2
1054,"Oracle Makes  #39;Final #39; PeopleSoft Offer After much speculation that it would raise its bid yet again, Oracle Corp. Monday morning announced its latest offer for PeopleSoft Inc.",2
1055,"Reebok star rises in south: Shoemaker targets Hispanic markets Reebok International Ltd. is turning its attention to the growing US Hispanic population, starting with an ad campaign promoting Reebok #39;s ties to the wildly popular Chivas soccer club in Mexico.",2
1056,Rouse Sale Ends Independence of Unique Visionary The \$7.2 billion sale of The Rouse Co. marks the end of a fiercely independent real estate and shopping mall company that oversaw America #39;s 20th Century migration from ,2
1057,"Corus Reports First-Ever Profit as Steel Prices Soar (Update3) Corus Group Plc, the UK #39;s biggest steelmaker, reported its first profit and said earnings will rise in the second half because of higher steel prices and cost cutting by Chief Executive Officer Philippe Varin.",2
1058,Sluggish economy hits German jobs Unemployment in Germany rises for the tenth straight month as growth remains sluggish despite a revival in domestic demand.,2
1059,"Nortel Says 3rd-Qtr Revenue Will Fall From 2nd Qtr (Update3) Nortel Networks Corp., North America #39;s largest telephone-equipment maker, said third-quarter revenue will decline from the second quarter #39;s \$2.",2
1060,"India #39;s growth target lowered, anti-inflation measures unveiled: Business India: Mumbai, Oct 26 : India #39;s growth forecast for the current fiscal was Tuesday lowered to 6-6.5 percent by the Reserve Bank of India (RBI), which also unveiled measures to arrest the inflation rate.",2
1061,"Microsoft Ends Decade of US Antitrust Litigation Microsoft Corp. (MSFT.O: Quote, Profile, Research) said on Monday it had agreed to settle antitrust lawsuits with Novell Inc. (NOVL.",2
1062,"Disney Profit Up, TV Outshines Studio (Reuters) Reuters - Walt Disney Co.  posted a 24\percent rise in profit on Thursday as advertising gains at ESPN\and ABC television networks more than made up for a sharp\slowdown at Disney's movie studio.",2
1063,"WPP buys Grey Global WPP beat smaller French rival Havas and US private equity firm Hellman and Friedman, acquiring the last large independent advertising group after a 1990s consolidation in the industry.",2
1064,"Stocks Close Higher in Light Volume  NEW YORK (Reuters) - U.S. stocks made strong gains on  Wednesday as a tumble in oil prices boosted investor confidence  about the economy, but thin volume meant dealers were skeptical  about the strength of the rally.",2
1065,"Bumper profits, but debt blows out By staff writers and wires. AUSTRALIAN company profits jumped 10.3 per cent in the June quarter thanks to robust consumer and business spending that will boost economic growth outcomes and the electoral prospects of the Howard Government.",2
1066,"Is Search About To Be Amazoned? Amazon.com has entered the search-engine wars with the debut of A9.com. The site, which relies on Google search technology, includes personalization features like a running log of sites visited ",2
1067,Hurricane Charley Tears Into Outback (Reuters) Reuters - Outback Steakhouse Inc. (OSI.N) on\Tuesday said it lost about 130 operating days and up to  #36;2\million in revenue because it had to close some restaurants in\the South due to Hurricane Charley.,2
1068,"U.S. Job Gains Strongest in Seven Months  WASHINGTON (Reuters) - New U.S. jobs soared at the sharpest  rate in seven months in October, the government reported on  Friday, helped by a surge in construction activity as  hurricane-battered areas in the Southeast were rebuilt.",2
1069,"Greenback strengthened slightly after energy price spike pressures &lt;b&gt;...&lt;/b&gt; The dollar strengthened slightly against major currencies in Asian trade yesterday, with the yen coming under pressure from a further spike in crude oil prices, dealers said.",2
1070,"Fed: Economic Growth on Track US economic expansion remains on track and inflation under control, top Federal Reserve officials said Wednesday in comments likely to reinforce views the Fed will hike rates again this year.",2
1071,"Dollar rallies, but continued weakness expected The dollar rallied after dropping to a record low yesterday against the euro amid uncertainty about whether officials would intervene to curb the currency's slide.",2
1072,"Google Faces Challenge of Public Company Status Your name is synonymous with searching the Internet, and you #39;ve just raised roughly \$1.7 billion from investors by going public.",2
1073,"KB Toys mulls closing Crabtree location Toy retailer KB Toys Inc. announced Tuesday that it will close 141 to 238 underperforming stores by Jan. 31, 2005. The company #39;s store at Crabtree Valley Mall on Glenwood Avenue is one of the locations KB Toys says it is considering closing.",2
1074,"UPDATE 1-PacifiCare to buy American Medical for \$502 mln PacifiCare Health Systems Inc. (PHS.N: Quote, Profile, Research) , one of the biggest Medicare plan providers, said on Wednesday it has agreed to buy health-care benefits provider American Medical Security Group Inc.",2
1075,Oil price climbs back above \$50 The price of crude oil moves back above the benchmark \$50 a barrel mark as production facilities in the Gulf of Mexico remain down.,2
1076,"UPDATE 1-ING to sell Baring Asset Management Financial group ING (ING.AS: Quote, Profile, Research) has agreed to sell Baring Asset Management (BAM) to US groups MassMutual and Northern Trust (NTRS.",2
1077,"The Dollar Slips Against the Yen  TOKYO (Reuters) - The dollar slipped against the yen on  Wednesday on a round of selling by Japanese exporters, but it  found support from intervention worries and caution ahead of  U.S. non-farm payrolls data due later in the week.",2
1078,"Vivendi, Messier Each Fined EU1 Million by Regulator (Update2) Jean-Marie Messier, the former chief of Vivendi Universal SA who is under investigation for alleged fraud and stock manipulation, was fined 1 million euros (\$1.3 million) by French regulator ",2
1079,"Dow Up Again as Stocks Log Second Straight Week of Gains Tech stocks shone for a second straight day, this time with Dell in the lead after it posted a 25 percent increase in third-quarter profits and matched forecasts for its outlook.",2
1080,"Southern Co. Quarterly Profit Rises Southern Co. (SO.N: Quote, Profile, Research) , which supplies power to the US Southeast, said Thursday its third-quarter earnings rose slightly, as increased energy use in the industrial ",2
1081,"Fed Raises US Rates for Fifth Time This Year The Federal Reserve raised US interest rates on December 14, 2004 by a quarter-percentage point for the fifth time this year and said it will keep gradually lifting them from rock-bottom levels as the economy grows.",2
1082,"Oil prices fall 14 per cent in a week NEW YORK - Crude oil futures fell for a fourth day Friday, settling below \$43 a barrel for the first time since August and extending the week #39;s decline in oil prices to 14 per cent.",2
1083,"Greenspan Floats Higher Retirement Age An aging population will put significant stresses on the budget deficit over the next three decades, a problem that could be solved by raising the retirement age, Federal Reserve Chief Alan Greenspan said in a speech Friday.",2
1084,Kmart to sell 18 stores to Home Depot NEW YORK - Retailer Kmart Holdings Corp. on Monday said it finalized a deal to sell 18 of its stores to Home Depot Inc. for \$271 million.,2
1085,"Raytheon Buys Photon Research Associates Defense contractor Raytheon Co. said Wednesday that it purchased privately held Photon Research Associates Inc., a provider of physics-based modeling services for government customers.",2
1086,Western Digital Outlook Spurs Sector Disk drive makers were on a roll Wednesday morning after industry giant Western Digital Corp. upped its outlook for the current quarter.,2
1087,"Jardine Lloyd Profit to Fall; Chief Executive Quits (Update3) Jardine Lloyd Thompson Plc, the UK #39;s biggest publicly traded insurance broker, said Chief Executive Steve McGill quit and profit will decline this year because of a difficult #39; #39; second half.",2
1088,"China opens cities early to foreign lenders BEIJING China on Wednesday opened its ancient capital of Xi #39;an and an industrial city in the northeast to overseas banks, a year earlier than planned, as it eases restrictions on their expansion.",2
1089,"CA revokes some of Kumar #39;s benefits Computer Associates International Inc. said Monday it has revoked home security and office support benefits to former Chief Executive Officer Sanjay Kumar, who was indicted last week on ",2
1090,"Mexico Expects to Double Auto Output in 10 Years (Update1) Mexico expects to double automobile capacity in 10 years, attracting investment of as much as \$10 billion from foreign automakers, Economy Minister Fernando Canales said in an interview.",2
1091,"Door open for Hardie boss JAMES Hardie #39;s two most senior executives have agreed to stand aside after damning findings by a special inquiry into its asbestos liabilities, but chief executive Peter Macdonald ",2
1092,"Ottawa surplus swells to \$9.1 billion The federal government raked in billions more than it expected last year in personal and corporate income taxes, and slapped down all \$9.",2
1093,"Mortgage Rates Increase Mortgage rates rose this week, although 30-year mortgages were still below the 6 percent level for a fourth week, Freddie Mac said Thursday.",2
1094,"Morrisons find Safeway hard to digest The supermarket group Morrisons today revealed that Safeway #39;s performance had continued to decline, with like-for-like sales 7.9 per cent lower in the first half.",2
1095,"Sanofi Diet Drug Impressive in 2-Year Study  NEW ORLEANS (Reuters) - An experimental diet drug helped  people lose nearly four times as much weight as a placebo in an  eagerly anticipated two-year trial, researchers said on  Tuesday.",2
1096,"Bankruptcy looming at Delta, auditor says Delta Air Lines said Wednesday it has revised its 2003 annual report to include a new report by its independent auditor warning that bankruptcy is looming.",2
1097,DirecTV Sees Up to  #36;1.6 Billion Charge (Reuters) Reuters - Satellite television provider\DirecTV Inc. said it may take up to  #36;1.6 billion in charges to\write down the value of satellites it would use for\broadcasting instead of high-speed data services.,2
1098,"Judge Wants PeopleSoft To Explain Why It Turned Oracle Down During a scheduling hearing Wednesday, the judge overseeing Oracle #39;s attempt to overturn PeopleSoft #39;s takeover defenses said he wants to know exactly why PeopleSoft has turned down Oracle #39;s offer again.",2
1099,"NYRA Picks Chief Out of Racing Form Charles Hayward, a former top executive with The Daily Racing Form and Little Brown Publishing, was named yesterday to the top management position at the troubled New York Racing Association.",2
1100,"Oil Rises Nearly 2 Percent on Colder US Weather Oil prices jumped nearly 2 percent on Tuesday as colder weather in the United States, the world #39;s largest heating oil market, brought temperatures more in line with seasonal norms.",2
1101, #39;Culture change #39; required at AstraZeneca after key drug fails Astrazeneca Admitted yesterday to an over-optimistic culture within its drug development division as it revealed its recently launched lung cancer pill did not improve patients #39; life expectancy.,2
1102,"Southwest bids \$117M for ATA assets Southwest Airlines #39; package of \$117 million in cash, loan payoffs and preferred stock purchases was selected as the winning bid at the bankruptcy court-approved auction for certain ATA Airlines Inc.",2
1103,"WPP to bid for Grey Global today WPP and a US buyout firm will submit offers for US ad agency Grey Global today, while France #39;s Havas faces opposition to its bid from one of ",2
1104,"Magnitude of problem called unclear Water is accumulating on the underground roof of the Big Dig tunnels, according to Attorney General Thomas F. Reilly, who said yesterday that his office is trying to determine whether the pools of water pose any threat of damage to the \$14.",2
1105,"JPMorgan, Cazenove Announce Joint Venture JPMorgan Chase  amp; Co. and Cazenove Group PLC said Friday they were launching a joint venture to combine their investment banking services for British customers.",2
1106,"Saudi Arabian violence changed oil prices Oil prices were forced higher today by an outbreak of violence in Saudi Arabia and concerns that Opec may cut output. The cost of a barrel of light, sweet crude oil climbed to 43.31 US dollars after gunmen ",2
1107,"Devices Up on Medicare Decision Medical device stocks were in the spotlight Wednesday with Medicare #39;s proposal late Tuesday to expand coverage for implantable cardioverter defibrillators, or ICDs, bolstering shares of those companies making the devices.",2
1108,"Eurostar turns 10 years old LONDON, England -- Eurostar, the high-speed passenger services, is celebrating 10 years of service between Britain, France and Belgium.",2
1109,EU suspends US export sanctions The European Union suspends tariffs on US imports imposed earlier this year during a bitter trade dispute.,2
1110,"Cisco Profits Are Higher, but Investors Want More Cisco Systems, the largest maker of Internet networking equipment, reported Tuesday that its first-quarter profit rose 29 percent, squarely in line with Wall Street forecasts.",2
1111,"Tales of the City, Revisited This year, for the first time since the towers crumbled, New York City #39;s economy outperformed the nation #39;s. The average price for a Manhattan condo or co-op broke the \$1 million mark, a new record.",2
1112,Libya bidding to lure investment for oil sector Tripoli sets outs transparent bidding process for foreign firms to woo investment for sanctions-hit oil sector. By Hassen Zenati - TRIPOLI.,2
1113,"Gas prices top \$2 a gallon in state It's back: \$2 gasoline. After sliding steadily from late June through the Labor Day weekend, the average price for a gallon of self-serve unleaded gasoline in Massachusetts was back up to \$2.01 yesterday, according to the most recent survey by the American Automobile Association. The nationwide average also crossed over the \$2 threshold between Sunday and yesterday, AAA said.",2
1114,Bombardier chief to leave company Shares in train and plane-making giant Bombardier have fallen to a 10-year low following the departure of its chief executive and two members of the board.,2
1115,"Willis Hires Top Marsh Executive  NEW YORK (Reuters) - Insurance broker Willis Group Holdings  Ltd. &lt;A HREF=""http://www.investor.reuters.com/FullQuote.aspx?ticker=WSH.N target=/stocks/quickinfo/fullquote""&gt;WSH.N&lt;/A&gt; on Monday said it hired a top executive from  embattled rival Marsh   McLennan Cos. Inc. &lt;A HREF=""http://www.investor.reuters.com/FullQuote.aspx?ticker=MMC.N target=/stocks/quickinfo/fullquote""&gt;MMC.N&lt;/A&gt;",2
1116,Increase predicted in holiday travel throughout South Millions of travelers throughout the South will take to the roads and skies this week in anticipation of the Thanksgiving weekend _ bucking a trend of lower-than-normal holiday travel in recent years.,2
1117,Yen Weighed Down by Rising Cost of Oil  LONDON (Reuters) - The yen sank to a four-month low against  the euro and a six-week low versus the dollar on Tuesday as  investors fretted that soaring oil prices could jeopardize  Japan's economic recovery.,2
1118,"Creating a home office with Staples CEO HOPKINTON -- If there's one room in the house that's his, Ron Sargent says it's the home office.",2
1119,"SunGard Data to spin off business SunGard Data Systems Inc. said Monday it will spin off its information availability services business, which helps organizations maintain access to their electronic data during everything from minor mishaps to major disasters.",2
1120,"Lowe #39;s Profit Up 15 Pct., Tops Estimates Lowe #39;s Cos. (LOW.N: Quote, Profile, Research) , the No. 2 home improvement retailer, on Monday reported a 15 percent rise in third-quarter profit, topping estimates, aided by its expansion into large US markets.",2
1121,Australia #39;s Alinta: ACCC Won #39;t Oppose Dampier Pipe Bid-2- SYDNEY (Dow Jones)--Australian energy company Alinta Ltd. (ALN.AU) said Monday that Australia #39;s competition regulator won #39;t oppose its joint bid for the Dampier to Bunbury gas pipeline in Western Australia state.,2
1122,"German retail giant in shake-up Loss-making German department store giant Karstadtquelle plans a major shake-up to try to haul itself back into profit, amid rumours of thousands of job cuts.",2
1123,"Sagging Dollar Hits New Low Against Euro BRUSSELS, Belgium A top European Union official urged the United States on Monday to curb its deficits to help bolster the sagging dollar amid fears a strengthening euro would stifle Europes fledgling economic recovery.",2
1124,"Honda, GE Create Joint Company for Jet-Engine Sales (Update2) Honda Motor Co., Japan #39;s third- largest automaker, and General Electric Co., the world #39;s biggest jet-engine maker, formed a joint venture for their partnership to sell a new Honda engine for business aircraft.",2
1125,"Brewers take steps to attract merger support Molson drops a plan to have an option-holders #39; vote, and Coors hires an investment bank to court stock owners. In a bid to build support for its proposed merger with Adolph Coors Co.",2
1126,"Oil Rises to Record Near \$51 as Hurricanes Curbed US Output Crude oil prices rose to a record in New York and London after hurricanes in the Gulf of Mexico curbed US production for more than three weeks, slowing the accumulation of supplies to meet winter needs.",2
1127,"Sky is the limit The movement of oil prices this year, both in the international and local markets, has consistently maintained an upward trend causing hysteria in the global oil market.",2
1128,"Councilor envisions citywide wireless Web access Councilor John M. Tobin Jr. envisions a Boston Utopia, with greater public spirit and a more robust sense of community. And he says he knows how to achieve it: WiFi.",2
1129,Citigroup #39;s Curious Exec Exchange The giant #39;s CFO and Smith Barney #39;s chief swap jobs -- a regular rotation for managers on the rise or damage control in advance?,2
1130,"Growth is prime on agenda for Ipswich bank With \$3.9 million in new capital, First National Bank of Ipswich is pushing farther into New Hampshire and may add an investment arm to the \$330 million-asset community bank. And with a new ticker symbol of FIWC, First National is now publicly traded on the Over the Counter Bulletin Board.",2
1131,Prince pledges to rule Citigroup with an iron fist Observing the financial juggernaut that is Citigroup is a bit like sitting down to watch the local TV news in a typical big American city.,2
1132,"Urban Cowboy (Forbes.com) Forbes.com - Walk into the Urban Outfitters in Manhattan's West Village and you're tempted to sit down on one of the white vinyl benches near the entrance. From there you can admire the antique armoire with mirrored front, along with champagne flutes, martini shakers and small metallic Christmas trees. There are plenty of casual clothes for young women and men (target age: 18-30), as well as accessories, furniture, books, gifts, makeup and soaps. If you want shoes, you have to go to the back of the store near the registers, where the display is archly arranged to resemble a woman's dressing room.",2
1133,"AirAsia to make solid debut on Malaysian bourse next week &lt;b&gt;...&lt;/b&gt; Kuala Lumpur: Malaysia #39;s budget carrier AirAsia is expected to make a solid debut on the stock exchange Monday, with gains to be made from its retail initial public offer (IPO) price of 1.16 ringgit (0.31 dollars) a share, fund managers and analysts said ",2
1134,"BILLIONAIRE #39;S PAYDAY TO GILD GOLDEN YEARS While Wilbur Ross celebrates his new honeymoon, he #39;s also toasting his latest deal - an \$80 million bet that reaped a \$4.5 billion payoff in just two years.",2
1135,"Treasuries Flat, Consumer Gloom No Shock  NEW YORK (Reuters) - U.S. Treasury debt yields held near  seven-month lows on Tuesday after a soft reading on U.S.  consumer sentiment added modestly to concerns about the  economy.",2
1136,Hammons merger eyed John Q. Hammons is cooperating with a proposal by a Spanish company to take over the hotel magnates public business in a deal worth an estimated \$64 million.,2
1137,"Rio Tinto: Demand good despite high oil prices MELBOURNE: The world #39;s second-largest diversified miner, Rio Tinto Ltd Plc, said yesterday high oil prices were increasing its costs but were not dampening demand for its key commodities.",2
1138,1m an hour profit for BP Oil giant BP today posted record profits of \$3.94bn (2.14bn) after fuel prices hit new highs. The third quarter performance of Britain #39;s biggest listed company came as oil prices rose to an average of almost \$50 a barrel.,2
1139,"Airline Woes Reach Across The Atlantic ROME, Sept. 15 -- The airline industry shakeout that forced U.S. Airways Group Inc. into bankruptcy this week is rippling through Europe as well, with some forecasters predicting that only a handful of the continent's airlines can survive, and Italian authorities scrambling this week to keep national carrier Alitalia SpA aloft.",2
1140,"Some Doubt Stocks' Value as Prices Rise  NEW YORK (Reuters) - Stock prices are near the highest  level ever, but instead of triggering giddy euphoria, the rise  is inspiring doubt and concern that stock values might be too  high.",2
1141,"IBM Reassures Workers After Milestone China Deal During an IBM employee meeting here Wednesday, a worker got up and asked a question that perhaps only 10 years ago would have been unthinkable: If he wanted ",2
1142,"Jangled jingle bells As traditional as fruitcake, and less palatable, are the perennial holiday season snowball fights over displays, music, school programs and other expressions of angst that disrupt what we long to remember as  quot;the most wonderful time of the year.",2
1143,Dollar Near Lows After Sharp Slide  LONDON (Reuters) - The dollar languished near its lowest  level against the euro in over seven months as recent  lackluster data and soaring oil prices raised doubts over the  United States' growth outlook.,2
1144,"Unilever Pressures European Stocks (Reuters) Reuters - A profit warning from consumer products\giant Unilever and concern that oil prices, now topping  #36;46 a\barrel, will hurt company earnings kept European shares in\negative ground Monday.",2
1145,"Toyota targets hopes, dreams in new marketing and often humorous -- side today, as it launches an advertising and marketing push designed to appeal to buyers #39; personal aspirations.",2
1146,"Europe #39;s Frustration Grows as Dollar Hits Another Low Europe #39;s financial policy makers issued their strongest warnings yet about the dangers of a swooning dollar, and the dollar promptly sank to a new low against the euro.",2
1147,"Why Do You Invest? Investing without a plan is like becoming a vegetarian because you have a garden. So, why do you invest?",2
1148,"AOL: Is Half a Billion Enough? At its height, the combined AOL and Time Warner (NYSE: TWX) company market capitalization exceeded \$350 billion. When AOL used its big, bloated equity to buy Time Warner, the company offered Time Warner shareholders ",2
1149,"Kerry Churns Up Enthusiasm in Former Bush Bastion in Ohio This part of Ohio went for George W. Bush four years ago in a 20-point landslide. But the 2,500 screaming, arm-waving supports of Senator John Kerry who jammed ",2
1150,"Mickey #39;s Fight Club It was nearly 10 years ago that Disney CEO Michael Eisner began to seriously contemplate his own mortality. He #39;d just survived emergency bypass surgery, and he was worried: if something happened to him, who could possibly run Disney?",2
1151,"WestJet Estimates Cut on Load Factor Woes  MONTREAL (Reuters) - Analysts chopped their fourth-quarter  profit estimates for WestJet Airlines Ltd. &lt;A HREF=""http://www.investor.reuters.com/FullQuote.aspx?ticker=WJA.TO target=/stocks/quickinfo/fullquote""&gt;WJA.TO&lt;/A&gt; on  Wednesday and braced for turbulence in its share price, mainly  because of computer woes that hurt its online reservations  bookings.",2
1152,UPDATE: Stockland To Unveil A\$7.5B Bid For GPT - Sources SYDNEY (Dow Jones)--Australian diversified property group Stockland (SGP.AU) is set to launch a share-based bid for General Property Trust (GPT.,2
1153,"J.P. Morgan takes on workers as IBM outsourcing deal ends Undoing a technology outsourcing deal set in late 2002, J.P. Morgan Chase yesterday said it would take back 4,000 of IBM's employees who have been providing the Wall Street firm with an array of technology support services.",2
1154,"Telekom lifts forecast as net rises Deutsche Telekom, the largest European phone company, on Thursday raised its forecast for net income in 2004 and said it planned to pay its first dividend in three years, after its third-quarter profit more than doubled.",2
